商家UID,商家名称,collection_time,id,desc,create_time,text_extra,nickname,digg_count,comment_count,collect_count,share_count,tag,转录文本,share_url,has_transcript,video_duration,video_type,create_timestamp
3197814267721939,广西欧缇雅门窗,2025-08-25 17:09:37,7367571176064814336,#源头工厂 断桥铝门窗封阳台该怎么...#断桥铝门窗 #欧缇雅门窗南宁工厂,2024-05-11 10:59:12,"['源头工厂', '断桥铝门窗', '欧缇雅门窗南宁工厂']",广西欧缇雅门窗,9,1,1,-1,"['居家', '装修设计', '家装主材']","夜主逢阳台应该怎么选呢? 同样是当桥里门窗。 有人点你爆300多一瓶。 有人点你爆1000多一瓶。 里面有什么套路呢? 把这条视频看完,帮你省不少愿望钱。 第一,看形态的宽度。 就是我们平时所听到的。 110,113,120。 如果有人跟你说,气室越大,窗户越稳固。 那一定是在不用你。 只谈宽度,不谈庇候。 那一定是挂羊头卖狗肉。 第二,鹅的条必须用PA66。 随时等温泉设计。 其他都不要。 第三,五斤。 好的五斤相当于人类的欣赏。 如果想让门窗用的酒,必须选好品牌。 第四,玻璃。 玻璃原片要选择新意。 台播等大品牌。 要有3C认证,要符合生产标准。 要质量更有保障。 如果你不知道怎么选择。 欢迎来到OTL门窗工厂。 了解乡亲。",https://www.douyin.com/video/7367571176064814336,True,00:00:59,视频,1715396352
3197814267721939,广西欧缇雅门窗,2025-08-25 17:09:37,7367684127253892404,110系列平开窗！您的封窗最佳选择#...窗 #源头工厂 #欧缇雅门窗南宁工厂,2024-05-11 18:17:31,"['断桥铝门窗', '源头工厂', '欧缇雅门窗南宁工厂']",广西欧缇雅门窗,10,1,1,2,"['居家', '装修设计', '家装主材']",都是我们装行业经久饮食。 但对于我们OTR来说。 一年四季都是旺季。 就像我们这一款。 RT20系列。 断桥平开窗一样。 我们这一款采用的是。 45度角斜边压线的设计。 显得世界上更大气更美观。 玻璃采用的是。 有信义元片玻璃。 标配玻璃5加20A加5。 开启扇做的是无缝焊接的功力。 标配全套德国瑞纳斯五金。 垂直等温线设计。 加上三道密封。 做到了真正的隔音隔热。 选品自门窗就炒OTR。,https://www.douyin.com/video/7367684127253892404,True,00:00:42,视频,1715422651
3197814267721939,广西欧缇雅门窗,2025-08-25 17:09:37,7369163846554078504,#断桥铝门窗 永远相信一句话，价格...台 #源头工厂 #欧缇雅门窗南宁工厂,2024-05-15 17:59:36,"['断桥铝门窗', '封阳台', '源头工厂', '欧缇雅门窗南宁工厂']",广西欧缇雅门窗,12,4,4,1,"['随拍', '生活记录', '日常vlog']",产业都在内卷内卷你要看怎么卷。 有些东西外表一模一样内在却不一定一模一样。 相信吃过亏的一定深有体会。 价格和价值一定是成正体的。 有些时候你认为你得到了个免费的东西。 或许免费的才是最贵的。,https://www.douyin.com/video/7369163846554078504,True,00:00:19,视频,1715767176
3197814267721939,广西欧缇雅门窗,2025-08-25 17:09:37,7372130267517029667,这样的125重型断桥提升平移窗，你喜...头工厂 #系统门窗 #封阳台 #门窗人,2024-05-23 17:50:51,"['断桥铝门窗', '源头工厂', '系统门窗', '封阳台', '门窗人']",广西欧缇雅门窗,13,2,2,4,"['居家', '装修设计', '家装主材']",125重型断桥提升平衣窗。 具有平台窗的密封性。 又有推拉窗的通风效果。 可以加装这样的玻璃布篮。 安全又牢固。 极开极平。 这么高颜值的一款窗户。 值得推给有品味的你。,https://www.douyin.com/video/7372130267517029667,True,00:00:16,视频,1716457851
3197814267721939,广西欧缇雅门窗,2025-08-25 17:09:37,7374249590544944399,125六轨断桥推拉窗，大通风大视野，...头工厂 #门窗人 #系统门窗 #封阳台,2024-05-29 10:54:54,"['断桥铝门窗', '源头工厂', '门窗人', '系统门窗', '封阳台']",广西欧缇雅门窗,11,3,-1,2,"['居家', '装修设计', '家装主材']",谁说风的窗就不能完全通风。 但是你们就过我们这一款六轨全影推拉窗。 开启面积达到50%。 大通风大视野。 六轨双滑轮推拉顺滑。 框包扇嵌入式设计。 防水又密封。 这样的窗你喜欢吗。 MING PAO CANADA MING PAO TORONTO。,https://www.douyin.com/video/7374249590544944399,True,00:00:20,视频,1716951294
3197814267721939,广西欧缇雅门窗,2025-08-25 17:09:37,7375484971353394467,113系列智能平开窗，开启智能时代！#...统门窗 #源头工厂 #门窗人 #封阳台,2024-06-01 18:48:42,"['断桥铝门窗', '系统门窗', '源头工厂', '门窗人', '封阳台']",广西欧缇雅门窗,9,2,-1,1,"['居家', '装修设计', '家装主材']",天猫精灵打开窗户。 走高端之路不随波逐流。 今天来看这款时尚品质。 高端款智能屏开窗。 无需手动开关通透采光视野明亮。 天猫精灵关闭窗户。,https://www.douyin.com/video/7375484971353394467,True,00:00:37,视频,1717238922
3197814267721939,广西欧缇雅门窗,2025-08-25 17:09:37,7376833136786820352,漂移开启，不占空间不碰头，挤压式关...头工厂 #门窗人 #系统门窗 #封阳台,2024-06-05 10:00:23,"['断桥铝门窗', '源头工厂', '门窗人', '系统门窗', '封阳台']",广西欧缇雅门窗,9,-1,-1,4,"['居家', '装修设计', '家装主材']",既可以做窗又可以做门的漂浴窗你见过吗。 平衣开启方式不占用室内空间。 挤压式关闭更密封更防水。 旋转180度实现内倒功能。 雨天也能做到微通风哦。 既可以做门又可以做窗的漂浴窗你喜欢吗。,https://www.douyin.com/video/7376833136786820352,True,00:00:19,视频,1717552823
3197814267721939,广西欧缇雅门窗,2025-08-25 17:09:37,7378054449664740642,怎么样才算实力派门窗源头工厂？#断...头工厂 #门窗人 #封阳台 #系统门窗,2024-06-08 16:59:40,"['断桥铝门窗', '源头工厂', '门窗人', '封阳台', '系统门窗']",广西欧缇雅门窗,85,5,1,1,"['居家', '装修设计', '家装主材']",怎么样才算有实力的门窗源头工厂呢。 来OTR门窗。 原生理财库存多。 时刻满足公共需求。 保质保量 饱祸期。 我们的门窗款式多。 系统窗和集载门。 都是百看不厌的风格。 设计感强 功能性高。 产品紧跟时尚前端。 专业加工流程 细节到位。 专业原材料的优势。 打造经营好门窗。,https://www.douyin.com/video/7378054449664740642,True,00:00:29,视频,1717837180
3197814267721939,广西欧缇雅门窗,2025-08-25 17:09:37,7379223727365508352,#欧缇雅门窗 优选100个小区做品牌...的见证，更是服务和口碑相传的结果。,2024-06-11 20:36:57,['欧缇雅门窗'],广西欧缇雅门窗,10,-1,1,-1,"['随拍', '生活记录', '日常vlog']",,https://www.douyin.com/video/7379223727365508352,False,00:00:22,视频,1718109417
3197814267721939,广西欧缇雅门窗,2025-08-25 17:09:37,7381722502193483042,618欧缇雅门窗征集样板间啦！欢迎广...头工厂 #系统门窗 #门窗人 #封阳台,2024-06-18 14:13:34,"['断桥铝门窗', '源头工厂', '系统门窗', '门窗人', '封阳台']",广西欧缇雅门窗,18,-1,2,1,"['居家', '装修设计', '家装主材']","男女朋友们注意啦! 618我们曾经邀请您参加我们OTR门窗样板间的增加活动喔! 设计师会根据您家的需求和喜好进行订制,让您家变得更有品味! 我们从设计到生产、安装,全程提供专人对接,确保每个细节都符合您的希望! 最后,祝愿大家在2020下半年顺遂无虞,皆得所愿!",https://www.douyin.com/video/7381722502193483042,True,00:00:25,视频,1718691214
3197814267721939,广西欧缇雅门窗,2025-08-25 17:09:37,7385123661545557288,门窗暴风雨测试，让你更直观的感受...头工厂 #门窗人 #系统门窗 #封阳台,2024-06-27 18:11:49,"['断桥铝门窗', '源头工厂', '门窗人', '系统门窗', '封阳台']",广西欧缇雅门窗,214,3,5,2,"['居家', '装修设计', '家装主材']","每天都被狂风暴雨问候,你家的窗扛住了吗? OTR门窗作为专业性的防风雨门窗。 我们窗户的亲密性、水密性、抗风压性将会是怎么样的呢? 今天就来看一下我们的风雨测试。 现在我们这个材料是标配5加20、1加5的一个玻璃2.0的形态。 12级台风没有出现漏风漏雨的情况。 可以拿打火机试一下。 我们的产品都可以达到这样的一个效果。 有效保证,亲密性、水密性,雨天也能让您更放心,你知道了吗?",https://www.douyin.com/video/7385123661545557288,True,00:00:41,视频,1719483109
3197814267721939,广西欧缇雅门窗,2025-08-25 17:09:37,7388357010628037940,20秒告诉你#封阳台 选择工厂到底有...铝门窗 #门窗人 #系统门窗 #平开窗,2024-07-06 11:18:50,"['封阳台', '断桥铝门窗', '门窗人', '系统门窗', '平开窗']",广西欧缇雅门窗,89,2,1,2,"['居家', '装修设计', '家装主材']",做门窗选择工厂有什么优势呢。 到工厂看工艺 端结构 使用起来更放心。 人性化服务 专属定制设计 测量安装。 不管是平开窗还是推拉窗 你喜欢的款式我都有。 性价比这么高的窗户 确定不来看看吗。,https://www.douyin.com/video/7388357010628037940,True,00:00:18,视频,1720235930
3197814267721939,广西欧缇雅门窗,2025-08-25 17:09:37,7390318401194921268,门窗的本质在于对品质的偏执！每一...头工厂 #门窗人 #系统门窗 #封阳台,2024-07-11 18:10:07,"['断桥铝门窗', '源头工厂', '门窗人', '系统门窗', '封阳台']",广西欧缇雅门窗,79,5,3,-1,"['居家', '装修设计', '家装主材']",本创行业无论再怎么内卷。 最终还是要回归我们产品本身。 把服务做好。 把品质做好。 认真对待每一位客户。 这是时间给我们最好的礼物。 保证让您不吃。,https://www.douyin.com/video/7390318401194921268,True,00:00:29,视频,1720692607
3197814267721939,广西欧缇雅门窗,2025-08-25 17:09:37,7392157527955361076,封窗封阳台，你选择好品质还是低价...头工厂 #门窗人 #系统门窗 #封阳台,2024-07-16 17:06:54,"['断桥铝门窗', '源头工厂', '门窗人', '系统门窗', '封阳台']",广西欧缇雅门窗,246,4,5,3,"['居家', '装修设计', '家装主材']",本餐通用台你是选择好品质还是低价格低价的门窗呢确实能够节省一部分成本。 但同时你要准办后期的一些渗水生锈变形甚至更严重的一些后果先进的生产设备和我们是门窗源头工厂如果你想要高品质的门窗。,https://www.douyin.com/video/7392157527955361076,True,00:00:24,视频,1721120814
3197814267721939,广西欧缇雅门窗,2025-08-25 17:09:37,7392541538024246562,请认准欧缇雅防伪商标，杜绝一切假...头工厂 #门窗人 #系统门窗 #封阳台,2024-07-17 17:56:54,"['断桥铝门窗', '源头工厂', '门窗人', '系统门窗', '封阳台']",广西欧缇雅门窗,65,9,8,6,"['随拍', '生活记录', '日常vlog']",今天大家来看看有何辨别产品真美。 Okea门窗我们所有旅行台上都配有我们的品牌。 保护膜。 装上都有环维标志。 装用的胶后珍珠面都有我们Okea的logo。 玻璃保护膜上也会有我们Okea品牌的logo。 每片玻璃的右上角都有我们3C验证。 有PICC中国人宝藏宝。 有我们品牌的标志。 广大消费者如发现。 有疑似侵犯Okea商家的行为或者假冒伪劣产品。 欢迎向我师提供线索。 我师将进行维权打假。 Okea门窗为用户创造舒适生活。,https://www.douyin.com/video/7392541538024246562,True,00:00:54,视频,1721210214
3197814267721939,广西欧缇雅门窗,2025-08-25 17:09:37,7393303892806602036,我们不仅做国内市场，同时也在往国...统门窗 #源头工厂 #门窗人 #封阳台,2024-07-19 19:15:15,"['断桥铝门窗', '系统门窗', '源头工厂', '门窗人', '封阳台']",广西欧缇雅门窗,249,7,6,4,"['随拍', '生活记录', '日常vlog']",我是欧地亚世界马上的。 我们自己做国内市场。 才做国外市场。 最后这个十三米的车。 即将发往非洲。 大家不顾以待。 想珍惜太内疚。 沉醉于阴街托不赞赏。 母亲的爱却永未退让。 决心从爱心中挣扎。 亲吻中我报答。 春风化月恋透我的心。 一生眷顾美丽。 无言地松振。,https://www.douyin.com/video/7393303892806602036,True,00:00:42,视频,1721387715
3197814267721939,广西欧缇雅门窗,2025-08-25 17:09:37,7398831565373017379,#欧缇雅门窗 封窗封阳台不知道选哪...门窗 #源头工厂 #系统门窗 #封阳台,2024-08-03 16:45:36,"['欧缇雅门窗', '断桥铝门窗', '源头工厂', '系统门窗', '封阳台']",广西欧缇雅门窗,10,-1,-1,-1,"['居家', '装修设计', '家装主材']","南宁的业主想要定制全屋门窗,这些系列都是极好的。 极美110系列,门开窗2.0T后,结构稳定,轻松坐,落底大玻璃。 车轨断桥推拉窗,面积可达50%,大通风,大视野。 完美系统推拉门,挤在边框,可视面,安全性弱化。 座椅,座椅,座椅,座椅,座椅,座椅,座椅,座椅,座椅,座椅,座椅,座椅,座椅,座椅,座椅,座椅,座椅,座椅,座椅,座椅,座椅,座椅,座椅,座椅,座椅,座椅,座椅,座椅,座椅,座椅,座椅,座椅,座椅,座椅,座椅,座椅,座椅,座椅,座椅,座椅,座椅,座椅,座椅,座椅,座�。",https://www.douyin.com/video/7398831565373017379,True,00:00:36,视频,1722674736
3197814267721939,广西欧缇雅门窗,2025-08-25 17:09:37,7403253919914282290,在南宁需要定制门窗的业主们注意了...价，给您实惠的价格，点击咨询报价吧,2024-08-15 14:46:21,[],广西欧缇雅门窗,22,1,4,2,"['居家', '装修设计', '家装主材']",想要做全屋风窗的。 今天跟著我的镜头。 带你们一探到底。 OTR门窗爆管屏开窗。 以密封性能为核心。 做到无风焊接内外屏框。 全景视野大面积通风效果。 没错就是这款六轨钻桥推拉窗。 具有科技感的电动提升窗。 以智能方便吸引了不少人的眼球。 鱼和熊掌同时兼得。 是现实的写照。 气密提升窗。 挤在推拉门。 厨房优选好物。 立马动跑。 仿佛置身于大自然的。 铝合金阳光房。 谁不爱呢。 做阳台风窗。 OTR门窗为您提升。 全部OTR门窗解决方案。 赶紧点下方链接订阅金字发。,https://www.douyin.com/video/7403253919914282290,True,00:00:44,视频,1723704381
3197814267721939,广西欧缇雅门窗,2025-08-25 17:09:37,7403253920191008037,在南宁需要定制门窗的业主们注意了...价，给您实惠的价格，点击咨询报价吧,2024-08-15 14:46:21,[],广西欧缇雅门窗,91,12,20,5,"['居家', '装修设计', '家装主材']",正在选择断墙旅门窗。 让我为你推荐一家。 它就是博山OTIA门窗南宁工厂。 无论你是想封阳台或是封窗。 厨房格段还是阳光房都可以。 种类齐全。 真正做到工厂直销。 没有中阶商赚差价。 现在约成功。,https://www.douyin.com/video/7403253920191008037,True,00:00:29,视频,1723704381
3197814267721939,广西欧缇雅门窗,2025-08-25 17:09:37,7403253921361300746,欧缇雅门窗，真正的源头厂家，专注系...户提供设计制作安装售后一站式服务,2024-08-15 14:46:21,[],广西欧缇雅门窗,45,4,7,7,"['居家', '装修设计', '家装主材']",在南宁需要风扬台的业主定制一款无缝焊接平台窗需要多少钱一平方呢。 欧亭门窗源头工厂一件也是批发价提供上门两尺设计安装售后与暂时服务。 采用无缝焊接工艺表面无切口无清风光扇屏葱。 冷美观度更高搭配5加21加5的信意中风钢化玻璃。 整串抗风压性能更优越多枪体结构和锤子等纹线的设计装置PA66尼龙隔热条。 夏季隔热冬季保温买门窗来欧亭源头厂家报价更实在。,https://www.douyin.com/video/7403253921361300746,True,00:00:40,视频,1723704381
3197814267721939,广西欧缇雅门窗,2025-08-25 17:09:37,7415070448834153766,中秋节佳节到来之际，欧缇雅门窗祝...厂 #断桥铝门窗 #落地窗 #中秋快乐,2024-09-16 11:00:42,"['封阳台', '源头工厂', '断桥铝门窗', '落地窗', '中秋快乐']",广西欧缇雅门窗,384,4,4,2,"['随拍', '生活记录', '日常vlog']",台元广地幸福安康 中秋快乐。,https://www.douyin.com/video/7415070448834153766,True,00:00:37,视频,1726455642
3197814267721939,广西欧缇雅门窗,2025-08-25 17:09:37,7419649807469399322,这款138现代轻奢风 纯2.0极窄平开...阳台 #系统门窗 #源头工厂 #平开窗,2024-09-28 19:10:51,"['断桥铝门窗', '封阳台', '系统门窗', '源头工厂', '平开窗']",广西欧缇雅门窗,12,-1,3,3,"['居家', '装修设计', '家装主材']",追求高品质的客户都会选择我们OTR这款138纯2.0厚度集载系列。 全套好博5斤可选配有机座无机座执手。 智能屏开窗解放伤手可通过遥控或智能加剧操作。 小方形压线设计可视面1分8。 小面积开启防雨防盗卷连杀伤防蚊虫更安全。 内置折叠摆页控制客监睹增加生命性。 追求高品质的你值得拥有。,https://www.douyin.com/video/7419649807469399322,True,00:00:38,视频,1727521851
3197814267721939,广西欧缇雅门窗,2025-08-25 17:09:37,7420305566486023433,祖国75周年华诞，祝：祖国繁荣昌盛，...厂 #系统门窗 #封阳台 #断桥平开窗,2024-09-30 13:35:30,"['欧缇雅高端系统门窗', '源头工厂', '系统门窗', '封阳台', '断桥平开窗']",广西欧缇雅门窗,395,12,6,2,"['随拍', '生活记录', '日常vlog']",今秋十月迎国庆举国同庆贺生辰。 繁华世纪天新年乐趣有草 畅和平。 祝国繁荣享生活 阖家欢乐 品幸福。 OPM 门窗祝大家国庆快乐 幸福每天。,https://www.douyin.com/video/7420305566486023433,True,00:00:29,视频,1727674530
3197814267721939,广西欧缇雅门窗,2025-08-25 17:09:37,7425078351422901531,新款130磁悬浮六轨断桥推拉窗 颜值...断桥铝 #悬浮推拉窗厂家 #门窗产品,2024-10-13 10:16:28,"['断桥推拉窗封阳台', '封阳台换窗户', '断桥铝', '悬浮推拉窗厂家', '门窗产品']",广西欧缇雅门窗,11,3,1,3,"['居家', '装修设计', '家装主材']",传统的推拉窗你们见多了像这种轨道视频的推拉窗。 你们有见过吗。 50%的开启面积大通风大采光更显空间。 隐藏式轨道与D楼式双系统排水。 骑瓶轨道可加装超大扶手坐吧台。 单上最大可坐三台。 自动扭锁。 侧边依制左设计。 自带儿童锁。 双重保护。 嵌入式边框加上超透亮的玻璃。 标配304高清沙瓦。 这么好看又实用的旋幅推拉窗。 赶紧点击下方预约。 把它带回家。,https://www.douyin.com/video/7425078351422901531,True,00:00:45,视频,1728785788
3197814267721939,广西欧缇雅门窗,2025-08-25 17:09:37,7430444770364853514,我们的产品不仅是一件物品，更是一...阳台 #展会现场 #企业文化 #隔音窗,2024-10-27 21:20:57,"['欧缇雅安全系统门窗', '封阳台', '展会现场', '企业文化', '隔音窗']",广西欧缇雅门窗,23,1,3,-1,"['随拍', '生活记录', '日常vlog']",勇敢的努力来吧! 没来得为一场意料之外的痛快。 期待的英雄没来。 现在自己主宰。 那所谓的成败还没唱过呢。 就别急著去看看。 现在。 准备团战。 梦和夜之夜。,https://www.douyin.com/video/7430444770364853514,True,00:00:44,视频,1730035257
3197814267721939,广西欧缇雅门窗,2025-08-25 17:09:37,7435530037291535653,专做系统门窗的源头工厂，产品多类，...统门窗 #源头工厂 #封阳台 #大玻璃,2024-11-10 14:14:26,"['断桥铝门窗', '系统门窗', '源头工厂', '封阳台', '大玻璃']",广西欧缇雅门窗,14,1,1,-1,"['居家', '装修设计', '家装主材']",门窗源头工厂怎么走。 一条是便利。 少走弯路。 我们是专业在南宁生产系统门窗的源头工厂。 我们拥有完整的生产设备。 铝材大量库存。 全部采用6063T5原生铝。 从切割、组装、调式及暂时生产。 为您提供更多的生产。 你的产品遮风挡雨。 我们主要生产平开窗。 推拉窗、提升窗、漂移窗、悬浮窗。 还有吊轨完美系统。 动型推拉门等。 可以根据你的产品要求。 做定制所需要的材料。 买门窗来我这里。 好品质你自己。 值得拥有。,https://www.douyin.com/video/7435530037291535653,True,00:00:44,视频,1731219266
3197814267721939,广西欧缇雅门窗,2025-08-25 17:09:37,7437833683471486218,业主装了都说好的110系统窗#系统门...铝门窗 #封阳台 #源头工厂 #平开窗,2024-11-16 19:13:39,"['系统门窗', '断桥铝门窗', '封阳台', '源头工厂', '平开窗']",广西欧缇雅门窗,9,-1,1,1,"['居家', '装修设计', '家装主材']",今天来到杨补星给大家分享一款全化妆案例。 这一款呢 做的是我们110系列3 0的币后 多强体结构 整体的性能更好。 正面大玻璃也加装了科技感十足的智能电动平开窗 这一套风窗效果是你喜欢的吗。,https://www.douyin.com/video/7437833683471486218,True,00:00:28,视频,1731755619
3197814267721939,广西欧缇雅门窗,2025-08-25 17:09:37,7439567294348397874,想要找靠谱门窗工厂就来欧缇雅门窗...阳台 #系统门窗 #源头工厂 #平开窗,2024-11-21 11:21:04,"['断桥铝门窗', '封阳台', '系统门窗', '源头工厂', '平开窗']",广西欧缇雅门窗,102,4,1,-1,"['居家', '装修设计', '家装主材']",如果你家最近准备装修或者你想找一家靠谱的门窗工厂。 那我们一定是你的不二之选。 既要技术过硬材料优质同时还要保证售后无忧。 一家靠谱的工厂首先能与同样的价格用到更好的材料。 我们包粮食设计安装售后。 那我们。 我们穿工厂的质量是怎么样的呢。 其实很简单。 因为我们是博山品牌公司。 在广西有三家工厂分别在客州桂林南宁。 在广西各个地区都能随时看生产流程哦。,https://www.douyin.com/video/7439567294348397874,True,00:00:41,视频,1732159264
3197814267721939,广西欧缇雅门窗,2025-08-25 17:09:37,7440324207642250533,“品”味人生 “质”造美好生活#断桥铝...阳台 #系统门窗 #源头工厂 #平开窗,2024-11-23 12:18:11,"['断桥铝门窗', '封阳台', '系统门窗', '源头工厂', '平开窗']",广西欧缇雅门窗,9,-1,-1,-1,"['居家', '装修设计', '家装主材']",只看成品你怎么知道这门窗是真好还是假好。 总得看看它好在哪里。 天天看门窗源头工厂品味人生 制造美好生活。,https://www.douyin.com/video/7440324207642250533,True,00:00:27,视频,1732335491
3197814267721939,广西欧缇雅门窗,2025-08-25 17:09:37,7442639790178192699,欢迎选择欧缇雅门窗#系统门窗 #落地窗 #隔音窗 #大玻璃 #家装,2024-11-29 18:03:44,"['系统门窗', '落地窗', '隔音窗', '大玻璃', '家装']",广西欧缇雅门窗,11,-1,-1,-1,"['居家', '装修设计', '家装主材']",窗子选不对 装修再好 也受冷风吹。 谁要身体不受罪 就选OTR系统门窗。 把这你安乐不后悔。 在边框 大视野 阳光照进屋 你的心里暖呼呼。 双重中空 钢划波 有下静音 静想安心睡。 德诺峰PA66隔热条 就像外面冷风吹 你的家里一样温暖如春。 地露式排水设计 美观还反胜。 防护盾脚设计 贴心守护 家人安全。 还可以加装安全防盗格 贴心服务 送到家。 想要买门窗。 还得找行家 欢迎选择OTR系统门窗。,https://www.douyin.com/video/7442639790178192699,True,00:00:49,视频,1732874624
3197814267721939,广西欧缇雅门窗,2025-08-25 17:09:37,7445184681542208795,房子装修该选择什么样的门窗呢？ #...隔音窗 #落地窗 #大玻璃 #家装装修,2024-12-06 14:39:27,"['封阳台', '隔音窗', '落地窗', '大玻璃', '家装装修']",广西欧缇雅门窗,7,-1,-1,-1,"['居家', '装修设计', '家装主材']",99%的业主准备装修的时候都满脑子畅想著新家。 但是一看到这个毛屁房却又不知所措。 特别是门窗不知道该怎么选择。 那现在呢我告诉大家四大不选原则。 工艺不合格不买你可以用右眼去看一下它这个表格。 表面是非常光滑的无风焊接工艺。 如果工艺不合格下一家。 性能不达标咱不买来看一下安全性能。 看宽度看厚度隔热保温看断桥水密气密看胶条。 隔音呢看玻璃这些是平泛我们门窗质量的重要因素。 还要看一下有没有中国元宝3c认证。 价格便宜的门窗更不能买你以为你省钱了吗。 其实根本就不是因为低价的门窗呢。 综合性能和安全性能会比较差。 时间一段久了一系列问题都会出来。 售后无保障的我们不买。 除了选择高品质的产品之外呢。 他有没有专业的设计团队以及售后服务团队。 比如说测量安装还有售后等等服务。 这样的话你还不选择OK我们冲吗。,https://www.douyin.com/video/7445184681542208795,True,00:01:13,视频,1733467167
