商家UID,商家名称,collection_time,id,desc,create_time,text_extra,nickname,digg_count,comment_count,collect_count,share_count,tag,转录文本,share_url,has_transcript,video_duration,video_type,create_timestamp
3197814267721939,广西欧缇雅门窗,2025-08-25 17:09:37,7445896218481364251,密封胶条是哪三道呢？#封阳台 #系统门窗 #家装装修 #隔音窗 #落地窗,2024-12-08 12:40:22,"['封阳台', '系统门窗', '家装装修', '隔音窗', '落地窗']",广西欧缇雅门窗,6,1,-1,-1,"['居家', '装修设计', '家装主材']","你知道门窗的三档密封设计是哪三档吗? 第一道,外侧拨扇指口胶条与形态的压合具有等腔的排水作用。 有效防雨水空气的渗入。 第二道是内侧刷扇指口胶条与形态的压合。 请关键性提醒。 第三道是中间等压胶条与隔热条的搭接。 提高气密性能,让室内保持干爽的秘密所在。 三档密封设计使整窗的密封性大幅度提升。 三档密封就可以达到这样的效果,你心动了吗?",https://www.douyin.com/video/7445896218481364251,True,00:00:43,视频,1733632822
3197814267721939,广西欧缇雅门窗,2025-08-25 17:09:37,7447335197705604361,欧缇雅门窗，为用户创造舒适生活#系... #落地窗 #家装装修 #阳台设计装修,2024-12-12 09:44:37,"['系统门窗', '封阳台', '落地窗', '家装装修', '阳台设计装修']",广西欧缇雅门窗,51,-1,2,-1,"['居家', '装修设计', '家装主材']","加热换窗户可能80%的人都被割了韭菜。 今天一条视频告诉你怎么选择适合自己的门窗。 不想被外面的吵吵声吵醒就选这种中空玻璃。 空间填充惰性气体隔阴还隔温。 再者就是看断桥里的窗框。 一般有110、113。 数字越大,稳定性越强。 台风天来了也不怕。 怕雨水渗入就选这种隐藏式排水。 家里有孩子和宠物。 加个防护栏更安全。 而且高端系统门窗为用户创造更舒适生活。",https://www.douyin.com/video/7447335197705604361,True,00:00:40,视频,1733967877
3197814267721939,广西欧缇雅门窗,2025-08-25 17:09:37,7448825524660522255,欧缇雅门窗，多种压线设计方案#封阳...统门窗 #门窗人 #落地窗 #家居建材,2024-12-16 10:07:45,"['封阳台', '系统门窗', '门窗人', '落地窗', '家居建材']",广西欧缇雅门窗,41,2,3,-1,"['居家', '装修设计', '家装主材']",你知道门窗压线也是影响门窗安全性能的重要因素之一吗。 门窗压线的作用是把玻璃固定住 保证玻璃安装的牢固性以及安全性。 OTR门窗多种固定玻璃压线方案 内扣压线设计 有效提升门窗的密封性与安全性能。 标配斜边压线 时尚大气 空间力敌感强 布兜灰易打扫。 不同压线造型供应 满足不一样的风格追求。 安装便捷 造型简洁美观 提供安全 支撑力。,https://www.douyin.com/video/7448825524660522255,True,00:00:39,视频,1734314865
3197814267721939,广西欧缇雅门窗,2025-08-25 17:09:37,7451485469084355880,封窗封阳台就选113系统平开窗#封阳...窗 #落地窗 #阳台设计装修 #阳光房,2024-12-23 14:10:29,"['封阳台', '系统门窗', '落地窗', '阳台设计装修', '阳光房']",广西欧缇雅门窗,76,4,-1,-1,"['居家', '装修设计', '家装主材']","家里装修,要买门窗,我听必买推荐,来啦! 内外金属漆,2.0厚度和6枪体设计,形材表面光滑明亮,持久保清,耐高温,耐腐蚀,耐滑痕。 需要订制门窗的你,一定不要错过哦!",https://www.douyin.com/video/7451485469084355880,True,00:00:40,视频,1734934229
3197814267721939,广西欧缇雅门窗,2025-08-25 17:09:37,7452157570405387535,定制门窗，就选“欧缇雅系统门窗”#系... #封阳台 #阳光房 #落地窗 #大玻璃,2024-12-25 09:38:07,"['系统门窗', '封阳台', '阳光房', '落地窗', '大玻璃']",广西欧缇雅门窗,60,-1,3,2,"['居家', '装修设计', '家装主材']","你知道定制全屋门窗可以多赏心吗? EIDA OTIA门窗定制顾问一对一贴心服务。 专业设计师上门两次不错过每个角落。 根据全屋装修风格定制门窗方案。 交付定金后订单信息直达工厂门窗就够了。 约上门安装,安装完毕后告知业主进行验收。 定制OTIA门窗就是省心。",https://www.douyin.com/video/7452157570405387535,True,00:00:32,视频,1735090687
3197814267721939,广西欧缇雅门窗,2025-08-25 17:09:37,7478637090985626937,#欧缇雅门窗家博会展会7号8号9号三...53#品质门窗 #封窗封阳台#系统门窗,2025-03-06 18:11:35,"['欧缇雅门窗家博会', '品质门窗', '封窗封阳台', '系统门窗']",广西欧缇雅门窗,17,3,3,-1,"['居家', '装修设计', '家装主材']",好久不见 这里是OTA南宁门窗工厂。 专注高品质门窗生产多年。 壮大小心 注意注意注意。 华山总部百万补贴 总价值降20%。 每扇门窗都经过严格选材和精细工艺。 我们用心制造 只为给你带来安全舒适的家居体验。 从生产到自建 我们层层把关。 确保每一件产品都经得住考验。 明天家服会 欢迎大家来到现场体验我们的匠心自作。 家服会我们已经准备就绪OTA高单门窗。 与您共创美好家居生活。 明天我们不见不散。,https://www.douyin.com/video/7478637090985626937,True,00:00:43,视频,1741255895
3197814267721939,广西欧缇雅门窗,2025-08-25 17:09:37,7479776662964456739,#欧提雅门窗我们都是追梦人使用我...提雅门窗是我们的使命#向上的力量,2025-03-09 19:53:59,"['欧提雅门窗', '向上的力量']",广西欧缇雅门窗,263,14,8,4,"['随拍', '生活记录', '日常vlog']",小白云 词曲 李宗盛。 只要努力未来将无比全力。 也许成长的日子里。 一路坎坷尽尽。 也许一会儿肩上满身污泥。 千方几遍灰心还有我。 我们在这里。 露出微笑 拿出信心。 让清净风雨全都过。 成长岁月里。 我们是团结的集体。 相信我们会创造奇迹。,https://www.douyin.com/video/7479776662964456739,True,00:01:13,视频,1741521239
3197814267721939,广西欧缇雅门窗,2025-08-25 17:09:37,7481959973690313984,【3·15】品质保障，安心之选！守护家的...窗，诚信服务，放心选择！#欧缇雅门窗,2025-03-15 17:06:16,['欧缇雅门窗'],广西欧缇雅门窗,7,-1,1,-1,"['居家', '装修设计', '家装主材']",我们是佛山欧铁亚南宁门窗工厂。 拥有先进的生产设备和专业的技术团队。 我们始终坚持以质量为本。 每一扇门窗都经过严格的质量检测。 确保产品安全可靠。 在南宁我们基本为每个小区和家庭。 都提供了门窗订单服务。 收获了众多客户的质量。 我们会负责信赖和好评。 借此315消费选业之际。 我们将推出特别优惠活动。 欢迎新老客户全来自行选购。,https://www.douyin.com/video/7481959973690313984,True,00:00:33,视频,1742029576
3197814267721939,广西欧缇雅门窗,2025-08-25 17:09:37,7486360380613217551,开启位也俗称开扇，开多少个扇就要...同。#门窗开启位#封窗封阳台#系统窗,2025-03-27 13:42:10,"['门窗开启位', '封窗封阳台', '系统窗']",广西欧缇雅门窗,9,-1,1,-1,"['居家', '家具家电', '猎奇好物']",什么老板 这个开启位的话还要另外算吗 这不是明白的 二次收费了吗 美女。 根据每个月的定制产品 它不一样 你开启位的多跟少 它的成本也不一样 所以说这个呈现在。 设计的一个方面 包括开启位的5D配件 卧上 沙上 复光 它的成本。 是比较高的。 那为什么不直接把开启位的价格直接平衡在固定位上面呢 这么麻烦。 打个比喻 有的人一同样的尺寸开一个窗 而你要开两个甚至三个 说说他他成本不一样 说说我们会尝试这个开启位的额外的一个费用。 行吧 老板。 你爽快我也爽快 拿收款码过来付款吧。 感谢美女寻找我们 欧迪娅 美川 你的信念是我们服务的开始 把事情做好哦 必须的。,https://www.douyin.com/video/7486360380613217551,True,00:01:00,视频,1743054130
3197814267721939,广西欧缇雅门窗,2025-08-25 17:09:37,7496447742313024803,非洲客户亲临，欧缇雅门窗赢得国际...系统门窗 #封阳台 #阳光房 #落地窗,2025-04-23 18:06:16,"['欧缇雅门窗', '系统门窗', '封阳台', '阳光房', '落地窗']",广西欧缇雅门窗,8,-1,-1,2,"['居家', '装修设计', '家装主材']",今天我们接待了一位来自非洲的客户。 之前在我们这里下了一单。 觉得我们的产品质量很好。 这次他特地从非洲过来。 到我们欧提亚门窗工厂看产品。 对我们的产品非常满意。 当场又签了订单。 感谢这位客户的信任和支持。 我们会如既往的做好品质和服务。 让更多的朋友了解和认可我们的品质。,https://www.douyin.com/video/7496447742313024803,True,00:00:31,视频,1745402776
3197814267721939,广西欧缇雅门窗,2025-08-25 17:09:37,7498171841379929359,超窄的135极简幕墙窗，高颜值又有性... #封阳台 #阳光房 #落地窗 #大玻璃,2025-04-28 09:36:32,"['系统门窗', '封阳台', '阳光房', '落地窗', '大玻璃']",广西欧缇雅门窗,12,1,-1,-1,"['居家', '装修设计', '家装主材']",想要做差异化的产品。 窄边系列的可以看一下。 这款135极简木墙窗。 它的壁厚是6.0。 窝衫壁厚达到2.5。 最后壁厚达到10点。 采用江阴海达密封胶条。 窝衫是全面屏设计。 6063T6铝牌。 表面是用拉丝工艺处理。 标配信义玻璃。 5加25A加5高达。 极限设计。 历史节度侧边锁。 自带儿童锁。 多种开启方式。 正常的平台。 还有。 也可以开车135极限。 快把它带回家吧。,https://www.douyin.com/video/7498171841379929359,True,00:00:56,视频,1745804192
3197814267721939,广西欧缇雅门窗,2025-08-25 17:09:37,7499071092594674985,在本地买门窗，来欧缇雅工厂直营店，省去中间商，110系统窗只要398元㎡！,2025-04-30 19:45:53,[],广西欧缇雅门窗,81,44,44,10,"['', '', '']",如果你家正好有装门窗的需求。 恭喜你。 现在OTR110系统窗只要398元每平米。 包五斤 包玻璃 包安装。 做门窗我们更专业。 OTR门窗 南宁门窗源头厂家。 深耕门窗行业15年。 打造精益求精的门窗产品。 为客户提供设计制作 安装售后。 一战士服务。 欢迎实地考察 产品的质量。 现在点击视频下方链接预约。 即刻免费上门安装。,https://www.douyin.com/video/7499071092594674985,True,00:00:25,视频,1746013553
3197814267721939,广西欧缇雅门窗,2025-08-25 17:09:37,7499073427307793705,在本地买门窗，来欧缇雅工厂直营店，省去中间商，110系统窗只要398元㎡！,2025-04-30 19:54:56,[],广西欧缇雅门窗,381,169,156,51,"['', '', '']",丰阳台定制门窗。 最近的距离就是工厂直接到您家。 现在起到5月10日。 OTA110系统窗只要398元每平米。 OTA门窗。 专业定制门窗。 15年源头厂家。 提供一站式服务。 包五金。 包玻璃。 包安装。 各种门窗款式种类。 任你选择。 一对一服务。 免费上门粮食。 免费设计服务。 免费送货上门。 免费安装。 现在只要398元每平米起。 就能享受OTA一站式服务。 还在犹豫什么。 马上点击左下角报名了解吧。,https://www.douyin.com/video/7499073427307793705,True,00:00:30,视频,1746014096
3197814267721939,广西欧缇雅门窗,2025-08-25 17:09:37,7503774531614510387,欧缇雅专业15年制造高端门窗，398元...，设计、生产、安装、售后一站式服务！,2025-05-13 11:57:41,[],广西欧缇雅门窗,40,24,18,6,"['', '', '']",业主都追着我们下单。 因为15年1万多坪的门窗生产车间。 就是我们的底气。 我们华山OTA。 南宁门窗源头工厂。 拥有先进的生产设备。 和多条自动化生产线。 每一件产品都经过严格检测。 现在一系统门窗只要398。,https://www.douyin.com/video/7503774531614510387,True,00:00:31,视频,1747108661
3197814267721939,广西欧缇雅门窗,2025-08-25 17:09:37,7503774550446853386,欧缇雅门窗现在只要398元平米，优惠错过不再有！赶紧来咨询吧！,2025-05-13 11:57:41,[],广西欧缇雅门窗,20,4,9,1,"['', '', '']",如果你刚好在考装修需要订制。 推拉窗 平开窗 推拉门 平开门 折点门等。 热门产品我们都有。 我们OTR门窗订制源头工厂。 你一定要来看看。 我们可以免费测量 免费设计出效果图。 从生产设计到送后安装。 以暂时服务。 让你用更少的预算做更好的门窗。 同样的品质比普通门店价的更低。 现在资讯我还享受免费设计。 免费上门凉房 免费出门窗方案。 赶快这里找我吧。,https://www.douyin.com/video/7503774550446853386,True,00:00:31,视频,1747108661
3197814267721939,广西欧缇雅门窗,2025-08-25 17:09:37,7504568468763610387,在本地安装门窗怕买贵，就来我们欧...包玻璃包五金包安装，上门免费量尺！,2025-05-15 15:18:31,[],广西欧缇雅门窗,150,28,42,15,"['', '', '']",你家的门窗还在后面三家吗。 他买对了。 是怕买到质量不好的。 那就来我们OTM门窗云头工厂看看吧。 专注定制门窗15年。 现在还给南宁业主推出了一个大活动。 110系统屏开窗只要398一平方。 拒绝需高价格。 拒绝质量隐患。 免费上门凉房。 免费设置。 免费安装。 厂家服务更放心。 改底私信我。 抢载约会名额。,https://www.douyin.com/video/7504568468763610387,True,00:00:25,视频,1747293511
3197814267721939,广西欧缇雅门窗,2025-08-25 17:09:37,7504568468797279499,欧缇雅门窗现在只要398元平米，优惠错过不再有！赶紧来咨询吧！,2025-05-15 15:18:31,[],广西欧缇雅门窗,557,230,231,74,"['', '', '']",因为我们是在南宁深耕15年的门窗源头工厂。 同样的品质比普通门店价格更低。 从设计到做工度和噪音。 我们配有专业对。 提供客服专员对接。 依补出设计方案。 设计到您满意为止。 如果你也有定制门窗需求。 赶紧联系我领取优惠名额。,https://www.douyin.com/video/7504568468797279499,True,00:00:28,视频,1747293511
3197814267721939,广西欧缇雅门窗,2025-08-25 17:09:37,7505083610467224870,在本地买门窗，来欧缇雅工厂直营店，省去中间商，110系统窗只要398元㎡！,2025-05-17 00:37:37,[],广西欧缇雅门窗,114,77,43,14,"['', '', '']",加幽灵系列门窗只要398元每平方吗。 没错 398一平方。 包五金 包玻璃 包测量 包设计 包安装。 一条龙服务。 我们Altia门窗连头工厂。 专注门窗定制15年。 用实力诠释什么叫豪碰。 而且做的都是真材实料的安全系统门窗。 同样。 我们就是要把性价比做到极致。 不论是设备实力 服务 规模。 还是产品质量都经得起市场检验。 我们从不玩套路。 私信我 锁定优惠名额8。 错过可就亏大了。,https://www.douyin.com/video/7505083610467224870,True,00:00:35,视频,1747413457
3197814267721939,广西欧缇雅门窗,2025-08-25 17:09:37,7505083635536530738,欧缇雅专业15年制造高端门窗，398元...，设计、生产、安装、售后一站式服务！,2025-05-17 00:37:37,[],广西欧缇雅门窗,173,75,57,25,"['', '', '']",专差价。 南宁15年门窗大厂。 真正做到让利给业主朋友们。 海底私信我。 享受约会名额。,https://www.douyin.com/video/7505083635536530738,True,00:00:28,视频,1747413457
3197814267721939,广西欧缇雅门窗,2025-08-25 17:09:37,7507164805262855465,在本地买门窗，来欧缇雅工厂直营店，省去中间商，110系统窗只要398元㎡！,2025-05-22 15:13:39,[],广西欧缇雅门窗,35,11,11,4,"['', '', '']",通知下去。 我们OTR门充源头工厂优惠活动。 再加费。 可是我们OTR这个门充。 已经升级为398一平方了。 真的会推的。 不过必须加。 因为主朋友既要价格低。 又要品质好服务权。 不拿出我们15年门充大厂的本事。 怎么样留住客户啊。 那就包五斤 包玻璃 放两个。 两尺 包设计 包安装。 全部使用一线品牌铝材。 一线品牌五金。 一线品牌胶条。 没错。 就是让业主朋友们知道。 我们OTR门充源头工厂。 没有套路。 只有增长。 赶紧点击这里。 连续我们。,https://www.douyin.com/video/7507164805262855465,True,00:00:34,视频,1747898019
3197814267721939,广西欧缇雅门窗,2025-08-25 17:09:37,7507164802100235539,欧缇雅专业15年制造高端门窗，398元...，设计、生产、安装、售后一站式服务！,2025-05-22 15:13:40,[],广西欧缇雅门窗,14,9,2,2,"['', '', '']",3981平方。 3981平方。 3981平方。 到底什么是3981平方啊。 当然是佛山OP人们从南宁源头工厂的业组回馈活动。 现在高品质110系统人们从只要3981平方。 实力工厂不止品类众多。 而且。 款式齐全。 停开窗 停开门。 推拉窗 推拉门。 电动提升窗。 阳光房。 各种系列我们一应俱全。 现在预约成功还可以享受免费设计。 免费上门凉房 免费出双方案。 而且补好扩七块。 赶紧联系我们免费预约定制。,https://www.douyin.com/video/7507164802100235539,True,00:00:38,视频,1747898020
3197814267721939,广西欧缇雅门窗,2025-08-25 17:09:37,7509337741860064550,欧缇雅专业15年制造高端门窗，398元...，设计、生产、安装、售后一站式服务！,2025-05-28 11:45:56,[],广西欧缇雅门窗,15,-1,2,3,"['', '', '']",今天我们就把门窗价格给您打下来。 请在私信找我报名免费良房设计。 免费方案轻松到手。 新干方案再订制。 找我们包放新的。,https://www.douyin.com/video/7509337741860064550,True,00:00:27,视频,1748403956
3197814267721939,广西欧缇雅门窗,2025-08-25 17:09:37,7509337783324921115,欧缇雅专业15年制造高端门窗，398元...，设计、生产、安装、售后一站式服务！,2025-05-28 11:45:56,[],广西欧缇雅门窗,10,2,2,-1,"['', '', '']",挑战在南宁征集30副学亚门窗定制的业主。 免费设计。 免费上门凉房。 免费出门窗方案。 一站四服务全搞定。 我们OTR门窗连头工厂。 拥有15年门窗行业经验。 服务了3万家业主。 辩护南宁各个小区。 用专业和实力为您打造理想门窗。 从测量到安装。 我全程为您把关。 严格把控每一个环节。 让您省心又放心。 这波福利千载难逢。 你敢接下我的挑战吗。 那你私信我。 名额有限。 先到先得。,https://www.douyin.com/video/7509337783324921115,True,00:00:33,视频,1748403956
3197814267721939,广西欧缇雅门窗,2025-08-25 17:09:37,7517550202863160635,在南宁还在到处看门窗吗？快来欧缇...#封阳台#系统窗#大玻璃#南宁封阳台,2025-06-19 14:54:16,"['封阳台', '系统窗', '大玻璃', '南宁封阳台']",广西欧缇雅门窗,16,4,1,-1,"['居家', '装修设计', '家装主材']",在南宁你是不是还在到处看门窗。 看来看去是不是还没有找到合适的门窗。 来欧提亚门窗工厂有一半平方。 在广西深圳经有十多年。 拥有先进的生产设备。 每一间家庭都经过严格检测。 欧提亚门窗源头工厂之前用一千多一平方的门窗。 现在只要一千多一平方的门窗。 现在只要一千多一平方的门窗。 现在只要一千多一平方的门窗。 现在只要一千多一平方的门窗。 现在只要一千多一平方的门窗。,https://www.douyin.com/video/7517550202863160635,True,00:00:23,视频,1750316056
3197814267721939,广西欧缇雅门窗,2025-08-25 17:09:37,7521718917959175482,欧缇雅门窗，满足您对美的追求！#封窗封阳台#系统窗#大玻璃#南宁封阳台,2025-06-30 20:30:59,"['封窗封阳台', '系统窗', '大玻璃', '南宁封阳台']",广西欧缇雅门窗,18,4,-1,-1,"['居家', '装修设计', '家装主材']",这里是广西南宁门窗源头工厂。 作为源头工厂。 我们有强大的生产实力和工业链优势。 能够为您提供经济实惠的价格和更好的品质。 我们装修效果不适无可挑剔。 无论是客厅 厨房还是卧室。 都可以根据您的个性化需求进行订制。 我们提供。 用各种风格和选择。 满足您的美的对手。 如果您想了解更多详情。 欢迎关注私信我。,https://www.douyin.com/video/7521718917959175482,True,00:00:28,视频,1751286659
3197814267721939,广西欧缇雅门窗,2025-08-25 17:09:37,7522409583210581308,只要订单给到位，什么定制都能做#封...封阳台#系统窗#大玻璃#南宁封阳台,2025-07-02 17:11:08,"['封窗封阳台', '系统窗', '大玻璃', '南宁封阳台']",广西欧缇雅门窗,186,34,26,9,"['居家', '装修设计', '家装主材']","只要订单给到位,什么门窗都能做。 选门窗订制工厂,不是逛淘宝。 哪里便宜哪里少。 通窗不是路边摊,哪里便宜哪里酸。 品质不是游戏柜,哪里便宜哪里对。 如果你再找一家靠谱的门窗订制研投工厂。 欢迎来ONKL门窗。",https://www.douyin.com/video/7522409583210581308,True,00:00:22,视频,1751447468
3197814267721939,广西欧缇雅门窗,2025-08-25 17:09:37,7522818990160497977,欧缇雅平开窗，隔音又隔热#系统窗#...璃#南宁封阳台#装修设计 #门窗厂家,2025-07-03 19:39:52,"['系统窗', '大玻璃', '南宁封阳台', '装修设计', '门窗厂家']",广西欧缇雅门窗,6,-1,-1,1,"['居家', '装修设计', '家装主材']",就因为我给客户装了这一款110系列性能平开窗。 他恨不得给我介绍十几个客户忙得忙不过来了。 因为这个客户要求比较高嘛。 他家是靠马路边的。 所以说在隔音性能方面的话一定要好。 就这隔音效果。 这个体验法是不是管上瞬间安全多了。 各位业主。 如果说你家也是靠近马路。 可以看一下这款窗户。 而且我还可以带你去工地案例看看哦。,https://www.douyin.com/video/7522818990160497977,True,00:00:32,视频,1751542792
3197814267721939,广西欧缇雅门窗,2025-08-25 17:09:37,7523169515829906748,南宁业主看过来，要高端门窗又嫌贵？...厂 #落地大玻璃 #装修设计 #系统窗,2025-07-04 18:20:04,"['南宁封窗厂家', '欧缇雅门窗南宁工厂', '落地大玻璃', '装修设计', '系统窗']",广西欧缇雅门窗,10,-1,-1,-1,"['居家', '装修设计', '家装主材']",,https://www.douyin.com/video/7523169515829906748,False,00:00:24,视频,1751624404
3197814267721939,广西欧缇雅门窗,2025-08-25 17:09:37,7523532904213105979,在广西南宁，如果你报我的名字基本... #装修细节 #落地大玻璃 #系统门窗,2025-07-05 17:50:12,"['南宁封窗厂家', '门窗知识', '装修细节', '落地大玻璃', '系统门窗']",广西欧缇雅门窗,8,1,-1,1,"['居家', '装修设计', '家装主材']",在广西南宁如果你报上我的名字基本。,https://www.douyin.com/video/7523532904213105979,True,00:00:18,视频,1751709012
3197814267721939,广西欧缇雅门窗,2025-08-25 17:09:37,7523901325466307897,从工厂到您家，没有中间商赚差价！#... #封窗封阳台断桥铝门窗 #南宁装修,2025-07-06 17:39:50,"['南宁门窗厂家', '落地大玻璃封阳台', '装修设计', '封窗封阳台断桥铝门窗', '南宁装修']",广西欧缇雅门窗,7,1,-1,-1,"['居家', '装修设计', '家装主材']",真的看不下去了。 那些商场卖你们大几万的系统门窗。 其实成本也就那么回事。 为什么你们会被花那么多冤枉钱。 因为中间商赚了差价。 我们是在南宁做了15年的门窗定制工厂。 在我们这里直接砍掉中间环节。 想看样品、挑款式。 随时欢迎你到工厂看。 门窗质量好不好。 眼见为实。 需要装修换门窗的业主。 赶快来工厂扫我吧。,https://www.douyin.com/video/7523901325466307897,True,00:00:27,视频,1751794790
3197814267721939,广西欧缇雅门窗,2025-08-25 17:09:37,7524193277734636860,欧缇雅门窗工厂，街坊邻居都认准了！...家 #阳台封窗方案推荐 #落地大玻璃,2025-07-07 12:32:47,"['创作灵感', '系统门窗', '南宁封窗厂家', '阳台封窗方案推荐', '落地大玻璃']",广西欧缇雅门窗,9,-1,3,-1,"['居家', '装修设计', '家装主材']",到我这里只要398.1平方。 包5斤。 包按钮。 包测量。 你也喜欢。 赶紧私信我吧。,https://www.douyin.com/video/7524193277734636860,True,00:00:19,视频,1751862767
3197814267721939,广西欧缇雅门窗,2025-08-25 17:09:37,7524651695021100323,南宁装修别纠结，15年本土工厂直营#...台 #装修设计 #欧缇雅门窗南宁工厂,2025-07-08 18:11:41,"['创作灵感', '南宁系统门窗厂家', '封窗封阳台', '装修设计', '欧缇雅门窗南宁工厂']",广西欧缇雅门窗,3,-1,-1,-1,"['居家', '装修设计', '家装主材']",南宁都在歌校的乐主们。 你们买门穿一个个曲大稿。 究竟选哪一个。,https://www.douyin.com/video/7524651695021100323,True,00:00:24,视频,1751969501
3197814267721939,广西欧缇雅门窗,2025-08-25 17:09:37,7525019965914156347,南宁业主首选！110平开窗仅398元㎡，... #封窗封阳台 #装修设计 #门窗定制,2025-07-09 18:00:45,"['创作灵感', '南宁系统门窗厂', '封窗封阳台', '装修设计', '门窗定制']",广西欧缇雅门窗,8,4,-1,-1,"['居家', '装修设计', '家装主材']",南宁很多月主在我们这里购买。,https://www.douyin.com/video/7525019965914156347,True,00:00:17,视频,1752055245
